{
  "schema_version": "0.2",
  "capsule_version": "0.2",
  "installed_from": "_protocol/Project_Ops_Capsule",
  "installed_at": "2026-07-02",
  "run_ledger_required": true,
  "repair_iteration_limit": 2,
  "readme_update_mode": "audit-every-run",
  "variable_matrix_update_mode": "audit-every-run",
  "handoff_update_mode": "non-read-only",
  "subagent_policy": "solo-default",
  "profiles": [
    "public_repo",
    "software_project"
  ]
}
